{
 "season": 2026,
 "source": "kbo_official",
 "generatedAt": "2026-10-24T20:35:12.707Z",
 "qualifiedOnly": true,
 "pitchers": [
  {
   "playerId": "54640",
   "name": "네일",
   "teamName": "KIA",
   "teamId": "HT",
   "era": 1.29,
   "cg": 0,
   "sho": 0,
   "qs": 1,
   "bs": 0,
   "bf": 26,
   "pitches": 92,
   "oavg": 0.167,
   "h2": 1,
   "h3": 0,
   "sh": 0,
   "sf": 0,
   "ibb": 1,
   "wp": 0,
   "bk": 0
  },
  {
   "playerId": "54843",
   "name": "시라카와",
   "teamName": "KIA",
   "teamId": "HT",
   "era": 1.8,
   "cg": 0,
   "sho": 0,
   "qs": 0,
   "bs": 0,
   "bf": 19,
   "pitches": 76,
   "oavg": 0.211,
   "h2": 2,
   "h3": 0,
   "sh": 0,
   "sf": 0,
   "ibb": 0,
   "wp": 0,
   "bk": 0
  },
  {
   "playerId": "61145",
   "name": "이우찬",
   "teamName": "LG",
   "teamId": "LG",
   "era": 2.25,
   "cg": 0,
   "sho": 0,
   "qs": 0,
   "bs": 0,
   "bf": 14,
   "pitches": 60,
   "oavg": 0.154,
   "h2": 0,
   "h3": 0,
   "sh": 0,
   "sf": 0,
   "ibb": 0,
   "wp": 0,
   "bk": 0
  },
  {
   "playerId": "55633",
   "name": "올러",
   "teamName": "KIA",
   "teamId": "HT",
   "era": 3,
   "cg": 0,
   "sho": 0,
   "qs": 1,
   "bs": 0,
   "bf": 24,
   "pitches": 94,
   "oavg": 0.261,
   "h2": 1,
   "h3": 0,
   "sh": 0,
   "sf": 0,
   "ibb": 0,
   "wp": 0,
   "bk": 0
  },
  {
   "playerId": "55130",
   "name": "톨허스트",
   "teamName": "LG",
   "teamId": "LG",
   "era": 3.6,
   "cg": 0,
   "sho": 0,
   "qs": 0,
   "bs": 0,
   "bf": 20,
   "pitches": 82,
   "oavg": 0.176,
   "h2": 0,
   "h3": 0,
   "sh": 1,
   "sf": 0,
   "ibb": 0,
   "wp": 0,
   "bk": 0
  },
  {
   "playerId": "56168",
   "name": "케네디",
   "teamName": "LG",
   "teamId": "LG",
   "era": 4.15,
   "cg": 0,
   "sho": 0,
   "qs": 0,
   "bs": 0,
   "bf": 20,
   "pitches": 77,
   "oavg": 0.278,
   "h2": 0,
   "h3": 0,
   "sh": 0,
   "sf": 0,
   "ibb": 0,
   "wp": 0,
   "bk": 0
  }
 ]
}